A systematic review of transapical aortic valve implantation		Rahnavardi, M., Santibanez, J., Sian, K. and Yan, T. D.				annals of cardiothoracic surgery	annals of cardiothoracic surgery	BACKGROUND: Transcatheter aortic valve implantation (TAVI) through a transapical approach (TAAVI) for severe aortic stenosis becomes the procedure of choice in cases where patients have peripheral artery disease and unfeasible access due to excessive atherosclerotic disease of the iliofemoral vessels and aorta. The present systematic review aimed to assess the safety, success rate, clinical outcomes, hemodynamic outcomes, and survival benefits of TAAVI. METHODS: Electronic searches were performed in 6 databases from January 2000 to February 2012. The primary end points included feasibility and safety. Other end points included echocardiographic findings, functional class improvement, and survival. RESULTS: After applying the inclusion and exclusion criteria, 48 out of 154 shortlisted potentially relevant articles were selected for assessment. Of these, 26 studies from 24 centers including total number of 2,807 patients were included for appraisal and data extraction. The current evidence on TAAVI for aortic stenosis is limited to observational studies. Successful TAAVI implantation occurred in >90% of patients. On average, the procedure took between 64 to 154 minutes to complete. The incidence of major adverse events included 30-day mortality (4.7-20.8%); cerebrovascular accident (0-16.3%); major tachyarrhythmia (0-48.8%); bradyarrhythmia requiring permanent pacemaker insertion (0-18.7%); cardiac tamponade (0-11%); major bleeding (1-17%); myocardial infarction (0-6%); aortic dissection/rupture (0-5%); moderate to severe paravalvular leak (0.7-24%); cardiopulmonary bypass support (0-15%); conversion to surgery (0-9.5%); and valve-in-valve implantation (0.6-8%). Mean aortic valve area improved from 0.4-0.7 cm(2) before TAAVI to 1.4-2.1 cm(2) after TAAVI. The peak pressure gradient across the aortic valve decreased from >70 mmHg to <20 mmHg after TAAVI. One-year survival ranged from 49.3% to 82% and the 3-year survival was 58% in 2 series. CONCLUSIONS: TAAVI appears to be feasible with a reasonable safety and efficacy portfolio. Randomised controlled trials are required to compare transapical vs. transfemoral TAVI when both techniques are equally feasible.			2012				1027
Combination therapy an ACE inhibitor and an angiotensin receptor blocker for IgA nephropathy: a meta-analysis		Cheng, J., Zhang, X., Tian, J., Li, Q. and Chen, J.				international journal of clinical practice	international journal of clinical practice	Objective: The pathogenesis of IgA nephropathy (IgAN) is still unknown. Combination therapy with angiotensin-converting enzyme inhibitors (ACEIs) plus angiotensin receptor blockers (ARBs) might provide more benefits to IgAN patients. We conducted a systematic review to assess the efficacy of combination therapy for IgAN. Methods: The MEDLINE, EMBASE, the Cochrane Library and article reference lists were searched for randomised clinical trials (RCTs) which involved combination therapy ACEI plus ARB in only one arm. A meta-analysis was performed on the outcomes of proteinuria and renal function in IgAN patients. Results: Six RCTs involving 109 patients were included in the review. Combined treatment with ACEI plus ARB was more effective than with ACEI/ARB alone for reducing daily proteinuria. This did not translate into an improvement in GFR. Patients receiving ACEI plus ARB therapy did not have an increased risk of hyperkalemia. Conclusions: The current cumulative evidence suggests that combination therapy ACEI plus ARB may provide more benefits to IgAN patients for reducing daily proteinuria. Long-term effects of these agents on renal outcomes, and safety need to be established.			2012				2248
Meta-analysis of re-operation, nonunion, and infection after open reduction and internal fixation of patella fractures		Dy, C. J., Little, M. T., Berkes, M. B., Ma, Y., Roberts, T. R., Helfet, D. L. and Lorich, D. G.				the journal of trauma and acute care surgery	the journal of trauma and acute care surgery	BACKGROUND: The subcutaneous location of the patella and the demand for early knee motion contribute to the difficulty in treating patients with patella fractures. The reported rates in the literature for hardware removal after patella open reduction and internal fixation range from 0% to 60%. The wide variability of these reports leaves the true frequency of re-operation and complications after patella open reduction and internal fixation in question. Furthermore, gaining a better understanding of the factors that contribute to re-operation and complications will help to generate hypotheses and research agendas to address these difficult problems. METHODS: We performed a systematic review to identify publications in which adult patients with patella fractures were surgically treated with a minimum of 6-month follow-up. The surgical technique (tension band or other), infection rate, nonunion rate, and re-operation rate (including removal of hardware) were recorded. Meta-regression analysis was used to describe the potential contributory factors for re-operation, nonunion, and infection while controlling for age, gender, open fracture, surgical technique, and date of publication. Separate regression models were constructed for each outcome depending on the number of studies available for inclusion. RESULTS: The frequency of re-operation was 33.6% in a meta-analysis of 24 studies (737 patella fractures). The frequency of infection was 3.2% in a meta-analysis of 18 studies (522 patella fractures). The frequency of nonunion was 1.3% in a meta-analysis of 15 studies (464 patella fractures). There were no significant predictors for re-operation, nonunion, or infection in any of the regression analyses. CONCLUSION: Although the frequencies of nonunion and infection are relatively low after surgical treatment of patella fractures, the modern rate of re-operation is substantial. LEVEL OF EVIDENCE: Meta-analysis, level III+.			2012				2511
Prevention of Contrast-Induced Nephropathy in STEMI Patients Undergoing Primary Percutaneous Coronary Intervention: A Systematic Review		Busch, S. V., Jensen, S. E., Rosenberg, J. and Gögenur, I.				journal of interventional cardiology	journal of interventional cardiology	OBJECTIVE: To evaluate the current prophylactic strategies against CIN in patients with STEMI treated by primary percutaneous coronary intervention. BACKGROUND: Contrast-induced nephropathy (CIN) is the third leading course of acute renal failure and a recognized complication to cardiac catheterization. CIN is associated with increased risk of cardiac adverse events and mortality, and recent studies point at the risk of developing a transient or persistent renal dysfunction. Patients with ST-elevation myocardial infarction treated by primary percutaneous coronary intervention have a markedly increased risk of developing CIN. At present no strategy is universally accepted in the prevention of CIN in the acute setting of primary percutaneous coronary intervention. METHOD: We performed a systematic search in Pubmed and EMBASE and ended up including nine randomised clinical trials; six studies of N-acetylcysteine, one study of early and late hydration regimens, one study of recombinant human brain natriuretic peptide and one study comparing a low-osmolar contrast agent with an iso-osmolar contrast agent. RESULTS: Recombinant human brain natriuretic peptide and the regimens of hydration significantly reduced the incidence of CIN and administration of N-acetylcysteine in one of the six studies significantly reduced the occurrence of CIN. The iso-osmolar contrast agent was not proven to be superior to the low-osmolar contrast agent in terms of preventing CIN. CONCLUSION: Preliminary studies are promising but further studies are needed before any prevention strategy against CIN can be recommended in routine care of patients undergoing primary percutaneous coronary intervention for STEMI.			2013				3427
Flow-diverting stents for the treatment of arterial aneurysms		Sfyroeras, G. S., Dalainas, I., Giannakopoulos, T. G., Antonopoulos, K., Kakisis, J. D. and Liapis, C. D.				journal of vascular surgery	journal of vascular surgery	BACKGROUND: Anatomic factors may limit the application of stent grafts for the treatment of arterial aneurysms. Flow- diverting stents (FDSs) are specially designed to reduce flow velocity in the aneurysm sac and promote thrombosis while maintaining flow in the main artery and branch vessels. FDSs include the Pipeline Embolization Device (ev3, Plymouth, Minn), the SILK Arterial Reconstruction Device (Balt Extrusion, Montmorency, France), and the Cardiatis Multilayer Stent (Cardiatis, Isnes, Belgium). The first two have been mainly used for the treatment of intracranial aneurysms. The aim of this study was to review the current role of FDSs in the treatment of extracranial arterial aneurysms. METHODS: A systematic electronic health database search was conducted using PubMed, Ovid, Medline, and the Cochrane Database on all accessible published articles through March 2012. An additional search for abstracts presented in international congresses for vascular surgery was also performed. Full-text articles and abstracts were analyzed separately due to the heterogeneity of the data. RESULTS: Results of the use of FDSs in arterial aneurysms were reported in 12 full-text articles including 35 patients (26 men, age 65.4) with 38 aneurysms. The aneurysms were located in the hepatic (n = 12), splenic (n = 6), renal (n = 5), celiac (n = 4), superior mesenteric (n = 3), subclavian (n = 2), gastroduodenal (n = 1), and popliteal arteries (n = 1) and in the descending thoracic (n = 1), suprarenal (n = 1) and infrarenal aorta (n = 2). The 30-day mortality was 5.7% (2 of 35 patients). Three stent thromboses occurred (8.3%), none of them with clinical consequences. Thirty patients with 33 aneurysms and patent FDSs were monitored for an average of 9.2 months. Thrombosis occurred in 90.6%, and volume reduction was observed in 81% of the aneurysms. No branch vessel occlusion occurred. Twelve abstracts were identified, including 133 patients (mean age, 64.7 years). They included 62 peripheral, 28 visceral, and 43 abdominal and thoracoabdominal aneurysms. The Cardiatis Multilayer Stent was used in all cases. Thrombosis was achieved in all but two peripheral and visceral aneurysms. Volume reduction was observed in 82.7%, and no branch vessel occlusion occurred. In aortic aneurysms, better results regarding aneurysm thrombosis, reduction of the volume, and patency of collateral branches were reported at 12 months rather than at 6 months postoperatively. No aneurysm rupture has yet been described. CONCLUSIONS: Initial clinical experience with the use of FDSs in the treatment of visceral and peripheral aneurysms yielded satisfactory results in technical success, aneurysm thrombosis and shrinkage, and in patency of branch vessels. The results in aortic aneurysms are still under investigation. No aneurysm rupture has yet been described. There is a significant incidence of FDS thrombosis. Volume reduction of the aneurysm is a clearer evidence of the clinical success after treatment with FDSs than aneurysm thrombosis.			2012				2603
Efficacy and safety of deep brain stimulation in patients with medication-induced tardive dyskinesia and/or dystonia: a systematic review		Mentzel, C. L., Tenback, D. E., Tijssen, M. A., Visser-Vandewalle, V. E. and van Harten, P. N.				the journal of clinical psychiatry	the journal of clinical psychiatry	BACKGROUND: Tardive dyskinesia and dystonia (TDD) are severe side effects of dopamine-blocking agents, particularly antipsychotics. While deep brain stimulation (DBS) has proven effective in the treatment of TDD, little is known about the possible psychiatric complications of DBS in psychiatric patients. OBJECTIVE: To assess the efficacy and safety, specifically the psychiatric side effects, of DBS in patients with medication-induced TDD. DATA SOURCES: PubMed and EMBASE databases were searched systematically on May 25, 2011, for articles written in English, using the search terms deep brain stimulation AND tardive. STUDY SELECTION: Of the 88 original articles retrieved, 17 studies involving 50 patients with TDD who underwent DBS were included in the review. DATA EXTRACTION: Data on the severity of the movement disorders before and after DBS, as rated on the Burke-Fahn-Marsden Dystonia Rating Scale or similar scales, were extracted. Data on psychiatric symptoms before and after DBS were used to calculate the percent improvement per patient per rating scale. Overall improvement and confidence intervals were calculated using a 1-sample, 2-sided Student t test. RESULTS: The mean improvement of TDD of the combined patients 3 to 76 months after implantation was 77.5% (95% CI, 71.4%-83.3%; P < .000) on the Burke-Fahn-Marsden Dystonia Rating Scale. Of the 50 patients, 1 experienced an exacerbation of depression, and 1 experienced an exacerbation of psychosis. CONCLUSIONS: DBS seems to be effective and relatively safe for patients with treatment-resistant TDD; however, the results should be interpreted with caution, as most of the data are from case reports and small trials.			2012				1970
[Therapy of triangular fibrocartilage complex lesions]		Schädel-Höpfner, M., Müller, K., Gehrmann, S., Lögters, T. T. and Windolf, J.				der unfallchirurg	der unfallchirurg	The triangular fibrocartilage complex (TFCC) represents an important anatomical structure interposed between the ulnar carpus and the distal ulnar. Injuries and degenerative changes of the TFCC are of high clinical relevance and there are numerous treatment options available based on different concepts and which are being used to varying extents. The aim of this systematic review was to evaluate the effectiveness of different therapies for lesions of the TFCC. Studies on TFCC lesions were systematically reviewed, classified into evidence levels and selected according to predefined criteria. A total of 259 publications were identified as being potentially relevant and finally 35 studies could be included in the review. In addition, a survey was performed among German hand surgeons in order to identify commonly used procedures for TFCC lesions in Germany. The classification of Palmer is mostly used both in the literature and in Germany and therapeutic decisions are predominantly based on this classification. The systematic review revealed some common treatment strategies for traumatic and degenerative lesions. Generally, the level of evidence was poor for all identified publications. For this reason, evidence-based recommendations for the treatment of TFCC lesions could not be derived from the literature. There was broad consent between the results of the literature review and the survey.			2012				2078
Financial incentives for smoking cessation among pregnant and newly postpartum women		Higgins, S. T., Washio, Y., Heil, S. H., Solomon, L. J., Gaalema, D. E., Higgins, T. M. and Bernstein, I. M.				preventive medicine	preventive medicine	OBJECTIVE: Smoking during pregnancy is the leading preventable cause of poor pregnancy outcomes in the U.S., causing serious immediate and longer-term adverse effects for mothers and offspring. In this report we provide a narrative review of research on the use of financial incentives to promote abstinence from cigarette smoking during pregnancy, an intervention wherein women earn vouchers exchangeable for retail items contingent on biochemically-verified abstinence from recent smoking. METHODS: Published reports based on controlled trials are reviewed. All of the reviewed research was conducted by one of two research groups who have investigated this treatment approach. RESULTS: Results from six controlled trials with economically disadvantaged pregnant smokers support the efficacy of financial incentives for increasing smoking abstinence rates antepartum and early postpartum. Results from three trials provide evidence that the intervention improves sonographically estimated fetal growth, mean birth weight, percent of low-birth-weight deliveries, and breastfeeding duration. CONCLUSIONS: The systematic use of financial incentives has promise as an efficacious intervention for promoting smoking cessation among economically disadvantaged pregnant and recently postpartum women and improving birth outcomes. Additional trials in larger and more diverse samples are warranted to further evaluate the merits of this treatment approach.			2012				2365
A systematic review of single-bundle versus double-bundle anterior cruciate ligament reconstruction		Longo, U. G., Buchmann, S., Franceschetti, E., Maffulli, N. and Denaro, V.				british medical bulletin	british medical bulletin	INTRODUCTION: Double-bundle (DB) anterior cruciate ligament (ACL) reconstruction is becoming increasingly common. However, no definitive data on the superiority of DB reconstruction have been shown when compared with single-bundle (SB) ACL reconstruction. SOURCES OF DATA: We performed a comprehensive search of PubMed, Medline, Cochrane, CINAHL and Embase databases using various combinations of keywords such as 'ACL', 'reconstruction', 'DB' and 'SB'. Only articles published in peer-reviewed journals were included in this systematic review. AREAS OF AGREEMENT: Several new techniques are available for ACL reconstruction. DB ACL reconstruction could provide better outcome for patients in terms of closer restoration of normal knee biomechanics and improving the rotatory laxity of the knee. AREAS OF CONTROVERSY: Data are lacking to allow definitive conclusions on the use of DB reconstruction techniques for routine management of patients with ACL tear. GROWING POINTS: Given the limitations of the current studies, it is not possible to recommend systematic use of DB ACL reconstruction. Even though biomechanical results are encouraging, subjective patient evaluation is similar for SB and DB reconstruction. AREAS TIMELY FOR DEVELOPING RESEARCH: Studies of higher levels of evidence, for instances large adequately powered randomized trials, should be conducted to bring new insight in this field. With the current evidence available, a simple SB ACL reconstruction is a suitable technique, and it should be not abandoned until stronger scientific evidence in favour of DB ACL reconstruction will be produced.			2012				1139
A systematic review of the effect of low-level laser therapy in the management of breast cancer-related lymphedema		Omar, M. T., Shaheen, A. A. and Zafar, H.				supportive care in cancer : official journal of the multinational association of supportive care in cancer	supportive care in cancer : official journal of the multinational association of supportive care in cancer	PURPOSE: The purpose of this study was to review the effect of low-level laser therapy (LLLT) in the management of breast cancer-related lymphedema (BCRL). METHODS: A systematic review of seven databases for clinical trials for LLLT in the management of BCRL published between 1990 and 2011 was performed. RESULTS: A total of eight studies on 230 patients were found. The methodological qualities of the selected studies were assessed with the Physiotherapy Evidence Database scale, and the studies were categorized according to Sackett's levels of evidence. Five studies were graded at evidence level II. Two studies were graded at evidence level III, and the remaining study was graded at evidence level V. CONCLUSIONS: There is moderate to strong evidence for the effectiveness of LLLT for the management of BCRL from five small studies of acceptable methodological quality. A dose of 1-2 J/cm(2) per point applied to several points covering the fibrotic area can reduce limb volume following BCRL. Further well-designed, large-scale studies are required to determine more precisely how effective LLLT may be in BCRL.			2012				1448
Intratympanic steroid treatment for sudden deafness: a meta-analysis of randomized controlled trials		Garavello, W., Galluzzi, F., Gaini, R. M. and Zanetti, D.				otology & neurotology : official publication of the american otological society, american neurotology society [and] european academy of otology and neurotology	otology & neurotology : official publication of the american otological society, american neurotology society [and] european academy of otology and neurotology	BACKGROUND: The efficacy of intratympanic steroid (ITS) treatment in sudden deafness (SD) remains controversial. To shed light on this issue, we performed a systematic review of randomized controlled trials to assess the overall efficacy of ITS therapy and to clarify whether it is more suitable as a first-line approach (primary treatment) or as a salvage treatment when traditional systemic agents have failed. METHODS: An electronic database search (MEDLINE and PubMed) was performed with the objective of identifying all studies published in the English language between January 1980 and November 2011 on the efficacy of ITS in the treatment of SD. All relevant articles were retrieved, and the related reference lists were reviewed systematically to identify other reports that could be included. Data were synthesized using the Mantel-Haenszel model. Results are expressed as odds ratio (OR) with 95% confidence interval (CI). RESULTS: A total of 11 randomized studies including 472 subjects allocated to ITS and 453 controls were selected. Intratympanic steroid regimens used and treatments administered to controls varied widely across studies. When considering together trials investigating ITS therapy as a primary (n = 4) or salvage (n = 7) treatment, the common OR for recovery was 1.7 (95% CI, 1.3-2.3). When considering them separately, the common ORs for recovery were 0.9 (95% CI, 0.7-1.6) for primary and 2.9 (95% CI, 1.9-4.5) for salvage therapy. CONCLUSION: Intratympanic steroid therapy seems to confer a certain degree of benefit as a salvage but not as a primary treatment of SD. However, further evidence is needed to clarify some yet uncertain aspects, such as the optimal protocol of therapy.			2012				2514
Systematic review and meta-analysis of randomized trials on probiotics for hepatic encephalopathy		Holte, K., Krag, A. and Gluud, L. L.				hepatology research : the official journal of the japan society of hepatology	hepatology research : the official journal of the japan society of hepatology	AIM: ? The objective of this systematic review and meta-analysis was to assess the efficacy of probiotics and synbiotics in patients with hepatic encephalopathy. METHODS: ? Eligible trials were identified by searching electronic databases including MEDLINE, the Cochrane Library, Science Citation Index and Embase, abstract proceedings, reference lists and ongoing trial registers until 13?October 2010. We included randomized controlled trials comparing probiotics and synbiotics with no intervention, placebo or lactulose in patients with hepatic encephalopathy. The primary outcome measure was improvement in hepatic encephalopathy. RESULTS were expressed as risk rates (RR) with confidence intervals (CI) and intertrial heterogeneity as I(2) . RESULTS: ? Seven trials with a total of 393 patients were analyzed. Compared to placebo or lactulose, treatment with probiotics or synbiotics significantly improved hepatic encephalopathy (RR?=?1.40, 95% CI?=?1.05-1.86, I(2) ?=?5%). Probiotics decreased arterial ammonia (weighted mean difference 15.95; 95% CI?=?26.72-3.28; I(2) ?=?68%), but not venous ammonia (weighted mean difference 5.23; 95% CI?=?21.77-11.30; I(2) ?=?89%). Treatment with probiotics or synbiotics did not significantly affect the psychometric tests. Overall adverse events were reported in four trials with no difference between probiotics and placebo groups (RR?=?0.32, 95% CI?=?0.04-2.57; I(2) ?=?59%). Regression analysis showed evidence of small-study effects. CONCLUSION: ? The present meta-analysis suggests that probiotics may be an effective treatment of hepatic encephalopathy, though rigorous evaluation in standardized, randomized, clinical trial with clinically relevant outcomes is still needed.			2012				1271
